{
  "lineage_version": "1.0",
  "generated_utc": "2026-02-07T00:00:00Z",
  "chains": [
    {
      "chain_id": "PASS3_INCREMENTAL",
      "description": "Date-prefixed Jan 17 incremental PLUS chain. Each bundle extends the previous by appending a new PLUS segment, building up from PASS3 BYTE_TRUTH through PORTABILITY and FILE_HANDLING.",
      "bundles": [
        {
          "filename": "2026-01-17_MetaBlooms_OS_PASS3_BYTE_TRUTH_V2_PLUS_PHASE1_OS_BASELINE_V1.zip",
          "order": 1,
          "relationship": "ORIGIN",
          "parent_filename": null,
          "delta_description": "Initial PASS3 BYTE_TRUTH V2 with PHASE1 OS BASELINE V1. Origin of the incremental chain."
        },
        {
          "filename": "2026-01-17_MetaBlooms_OS_PASS3_BYTE_TRUTH_V2_PLUS_PHASE1_OS_BASELINE_V1_PLUS_DELTA_SEE_UBIQUITY_V1_FULL.zip",
          "order": 2,
          "relationship": "EXTENDED",
          "parent_filename": "2026-01-17_MetaBlooms_OS_PASS3_BYTE_TRUTH_V2_PLUS_PHASE1_OS_BASELINE_V1.zip",
          "delta_description": "Extends parent with DELTA_SEE_UBIQUITY_V1_FULL — adds SEE ubiquity layer."
        },
        {
          "filename": "2026-01-17_MetaBlooms_OS_PASS3_BYTE_TRUTH_V2_PLUS_PHASE1_OS_BASELINE_V1_PLUS_SEE_LOOP_P0.zip",
          "order": 3,
          "relationship": "EXTENDED",
          "parent_filename": "2026-01-17_MetaBlooms_OS_PASS3_BYTE_TRUTH_V2_PLUS_PHASE1_OS_BASELINE_V1.zip",
          "delta_description": "Extends parent with SEE_LOOP_P0 — adds SEE loop at phase 0. Parallel branch from same parent as file 2 (DELTA_SEE_UBIQUITY)."
        },
        {
          "filename": "2026-01-17_MetaBlooms_OS_PASS3_BYTE_TRUTH_V2_PLUS_PHASE1_OS_BASELINE_V1_PLUS_SEE_LOOP_P0_PLUS_SECURITY_AXIS_P0_PLUS_RESOURCE_CONCURRENCY_SCHEMA_V1.zip",
          "order": 4,
          "relationship": "EXTENDED",
          "parent_filename": "2026-01-17_MetaBlooms_OS_PASS3_BYTE_TRUTH_V2_PLUS_PHASE1_OS_BASELINE_V1_PLUS_SEE_LOOP_P0.zip",
          "delta_description": "Extends parent with SECURITY_AXIS_P0 and RESOURCE_CONCURRENCY_SCHEMA_V1."
        },
        {
          "filename": "2026-01-17_MetaBlooms_OS_PASS3_BYTE_TRUTH_V2_PLUS_PHASE1_OS_BASELINE_V1_PLUS_SEE_LOOP_P0_PLUS_SECURITY_AXIS_P0_PLUS_RESOURCE_CONCURRENCY_SCHEMA_V1_PLUS_PORTABILITY_CONFIG_DEPENDENCY_V1.zip",
          "order": 5,
          "relationship": "EXTENDED",
          "parent_filename": "2026-01-17_MetaBlooms_OS_PASS3_BYTE_TRUTH_V2_PLUS_PHASE1_OS_BASELINE_V1_PLUS_SEE_LOOP_P0_PLUS_SECURITY_AXIS_P0_PLUS_RESOURCE_CONCURRENCY_SCHEMA_V1.zip",
          "delta_description": "Extends parent with PORTABILITY_CONFIG_DEPENDENCY_V1."
        },
        {
          "filename": "2026-01-17_MetaBlooms_OS_PASS3_BYTE_TRUTH_V2_PLUS_PHASE1_OS_BASELINE_V1_PLUS_SEE_LOOP_P0_PLUS_SECURITY_AXIS_P0_PLUS_RESOURCE_CONCURRENCY_SCHEMA_V1_PLUS_PORTABILITY_CONFIG_DEPENDENCY_V1_PLUS_FILE_HANDLING_P0_V1.zip",
          "order": 6,
          "relationship": "EXTENDED",
          "parent_filename": "2026-01-17_MetaBlooms_OS_PASS3_BYTE_TRUTH_V2_PLUS_PHASE1_OS_BASELINE_V1_PLUS_SEE_LOOP_P0_PLUS_SECURITY_AXIS_P0_PLUS_RESOURCE_CONCURRENCY_SCHEMA_V1_PLUS_PORTABILITY_CONFIG_DEPENDENCY_V1.zip",
          "delta_description": "Extends parent with FILE_HANDLING_P0_V1. Terminal node of the incremental chain."
        }
      ]
    },
    {
      "chain_id": "PASS3_EXTENSIONS",
      "description": "Standalone PASS3 extensions without date prefix. These branch from the PASS3 lineage but lack explicit PLUS-chain lineage to the date-prefixed files. Relationship to PASS3_INCREMENTAL chain is inferred from shared PASS3 root.",
      "bundles": [
        {
          "filename": "MetaBlooms_OS_PASS3_PLUS_FILE_HANDLING_GATE_P0_V1.zip",
          "order": 1,
          "relationship": "ORIGIN",
          "parent_filename": null,
          "delta_description": "PASS3 with FILE_HANDLING_GATE_P0_V1. Likely derived from a PASS3 base (inferred), but no explicit parent in filename. Treated as chain origin."
        },
        {
          "filename": "MetaBlooms_OS_PASS3_PLUS_PHASEC3_MATERIALIZED_V1.zip",
          "order": 2,
          "relationship": "EXTENDED",
          "parent_filename": "MetaBlooms_OS_PASS3_PLUS_FILE_HANDLING_GATE_P0_V1.zip",
          "delta_description": "PASS3 with PHASEC3_MATERIALIZED_V1. Order relative to siblings is inferred (not certain); grouped here as PASS3 extensions."
        },
        {
          "filename": "MetaBlooms_OS_PASS3_PLUS_SHIPPING_PROCEDURE_V1.zip",
          "order": 3,
          "relationship": "EXTENDED",
          "parent_filename": "MetaBlooms_OS_PASS3_PLUS_PHASEC3_MATERIALIZED_V1.zip",
          "delta_description": "PASS3 with SHIPPING_PROCEDURE_V1. Possibly a peer rather than descendant of order 2; exact parent is inferred."
        }
      ]
    },
    {
      "chain_id": "WHOLEOS_GOVERNANCE",
      "description": "WHOLEOS governance chain from Jan 17-18, focused on SEE/MMD/ECL invariants and auto-audit.",
      "bundles": [
        {
          "filename": "MetaBlooms_OS_WHOLEOS_PLUS_AUTO_MMD_CONTRACT_AUDIT_V1_2026-01-17_PLUS_DELTA_SEE_MMD_ECL_2026-01-18_P1.zip",
          "order": 1,
          "relationship": "ORIGIN",
          "parent_filename": null,
          "delta_description": "WHOLEOS with AUTO_MMD_CONTRACT_AUDIT from Jan 17, extended with DELTA_SEE_MMD_ECL on Jan 18 at P1. Origin of governance chain (dated earlier: Jan 17)."
        },
        {
          "filename": "MetaBlooms_OS_WHOLEOS_PLUS_SEE_MMD_ECL_INVARIANTS_V1_2026-01-18.zip",
          "order": 2,
          "relationship": "EXTENDED",
          "parent_filename": "MetaBlooms_OS_WHOLEOS_PLUS_AUTO_MMD_CONTRACT_AUDIT_V1_2026-01-17_PLUS_DELTA_SEE_MMD_ECL_2026-01-18_P1.zip",
          "delta_description": "Consolidates SEE/MMD/ECL invariants into V1. Extends the audit+delta bundle. Relationship inferred from date progression and shared WHOLEOS+SEE_MMD_ECL naming."
        }
      ]
    },
    {
      "chain_id": "WHOLEOS_CANONICAL",
      "description": "WHOLEOS canonical chain from Jan 21. Starts with PAYLOAD_APPLIED, then fixes and wiring.",
      "bundles": [
        {
          "filename": "MetaBlooms_OS_WHOLEOS_CANONICAL_20260121_PAYLOAD_APPLIED_ACCEPT_OK.zip",
          "order": 1,
          "relationship": "ORIGIN",
          "parent_filename": null,
          "delta_description": "WHOLEOS CANONICAL with payload applied and acceptance confirmed. Origin of the Jan 21 canonical chain."
        },
        {
          "filename": "MetaBlooms_OS_WHOLEOS_CANONICAL_20260121_RUNTIMEENTRYPOINT_FIX.zip",
          "order": 2,
          "relationship": "PATCHED",
          "parent_filename": "MetaBlooms_OS_WHOLEOS_CANONICAL_20260121_PAYLOAD_APPLIED_ACCEPT_OK.zip",
          "delta_description": "Fixes runtime entry point issue. Supersedes parent."
        },
        {
          "filename": "MetaBlooms_OS_WHOLEOS_CANONICAL_20260121_P0FIX_REMEDIATED.zip",
          "order": 3,
          "relationship": "REMEDIATED",
          "parent_filename": "MetaBlooms_OS_WHOLEOS_CANONICAL_20260121_RUNTIMEENTRYPOINT_FIX.zip",
          "delta_description": "P0-level fix remediated. Supersedes parent."
        },
        {
          "filename": "MetaBlooms_OS_WHOLEOS_CANONICAL_20260121_P0FIX_REMEDIATED__WIRED_2026-01-21.zip",
          "order": 4,
          "relationship": "WIRED",
          "parent_filename": "MetaBlooms_OS_WHOLEOS_CANONICAL_20260121_P0FIX_REMEDIATED.zip",
          "delta_description": "Wired version of the remediated P0 fix. Extends parent with integration wiring."
        }
      ]
    },
    {
      "chain_id": "WHOLEOS_RUNTIME_GOVERNANCE",
      "description": "WHOLEOS runtime full governance chain, V2 to V3, Jan 21.",
      "bundles": [
        {
          "filename": "MetaBlooms_OS_WHOLEOS_RUNTIME_FULL_GOVERNANCE_V2_CANONICAL_20260121.zip",
          "order": 1,
          "relationship": "ORIGIN",
          "parent_filename": null,
          "delta_description": "WHOLEOS runtime full governance V2 canonical. Origin of governance runtime chain."
        },
        {
          "filename": "MetaBlooms_OS_WHOLEOS_RUNTIME_FULL_GOVERNANCE_V3_CANONICAL_20260121.zip",
          "order": 2,
          "relationship": "REBUILT",
          "parent_filename": "MetaBlooms_OS_WHOLEOS_RUNTIME_FULL_GOVERNANCE_V2_CANONICAL_20260121.zip",
          "delta_description": "Rebuilt as V3 of runtime governance. Supersedes V2."
        }
      ]
    },
    {
      "chain_id": "WHOLEOS_BASELINE_REBUILD",
      "description": "WHOLEOS BASELINE v1.2 rebuild chain, from initial rebuild through SHA fix repair.",
      "bundles": [
        {
          "filename": "MetaBlooms_OS_WHOLEOS_BASELINE_v1_2_P0_SEE_MMD_ECL_REBUILT_BOOT_OK.zip",
          "order": 1,
          "relationship": "ORIGIN",
          "parent_filename": null,
          "delta_description": "WHOLEOS BASELINE v1.2 rebuilt with P0 SEE/MMD/ECL and BOOT_OK confirmation. Origin of baseline rebuild chain."
        },
        {
          "filename": "MetaBlooms_OS_WHOLEOS_BASELINE_v1_2_P0_SEE_MMD_ECL_REBUILT_BOOT_OK_REPAIRED_SHAFIX_v2.zip",
          "order": 2,
          "relationship": "PATCHED",
          "parent_filename": "MetaBlooms_OS_WHOLEOS_BASELINE_v1_2_P0_SEE_MMD_ECL_REBUILT_BOOT_OK.zip",
          "delta_description": "Repaired with SHA fix v2. Supersedes parent. NOTE: A duplicate exists as 'MetaBlooms_OS_WHOLEOS_BASELINE_v1_2_P0_SEE_MMD_ECL_REBUILT_BOOT_OK_REPAIRED_SHAFIX_v2 (1).zip'."
        }
      ]
    },
    {
      "chain_id": "CANONICAL_P0_P1_MASTERY",
      "description": "CANONICAL P0/P1 mastery chain. Progresses from initial mastery content through patching, integration, and full wiring.",
      "bundles": [
        {
          "filename": "MetaBlooms_OS_CANONICAL_P0_P1_MASTERY_ENFORCED_V1_CONTENT.zip",
          "order": 1,
          "relationship": "ORIGIN",
          "parent_filename": null,
          "delta_description": "CANONICAL P0/P1 mastery V1 content. Origin of mastery chain."
        },
        {